evidence_id,component,observation,classification,release_impact
RNG-LEGACY,std::uniform_int_distribution,Legacy mapping differed across libc++ and libstdc++,historical_root_cause,resolved_by_migration
RNG-VECTOR,portable_bounded_v1,"8,704 C++ and independent Python vector outputs match",exact_mapping,pass
RNG-ENGINE,std::mt19937,Explicit 32-bit engine words and fixed seeds are retained,portable_engine_sequence,pass
RNG-CONSUMPTION,rejection path,Per-sample and cumulative engine-word consumption match vectors,exact_consumption,pass
RNG-THREADS,execution,Canonical stochastic tasks retain serial draw order independent of worker count,schedule_independent,pass
